{"id":"v2-canonical-header-redactor","version":1,"title":"Canonicalize ordered headers and redact credentials","family":"adversarial","difficulty":"hard","split":"dev","tags":["v2","serialization","redaction","headers"],"seed_repo":{"source":"benchmark/v2-development-wave4/fixtures/v2-canonical-header-redactor","revision":"sha256:3244a8dc6aef0b9bad7dbd036df2d66710599b21c1b68dc56eef0fdfe9695672","subdirectory":""},"instruction":"Harden redact_headers(headers, sensitive=()) as an ordered canonical serializer. headers is a list of two-item string pairs. Names must be non-empty ASCII HTTP token strings and values must contain no control characters. Canonicalize names to lowercase, preserve pair order, and reject duplicates after canonicalization. sensitive is a duplicate-free list, tuple, or set of valid names; authorization, cookie, and set-cookie are always sensitive. Replace every sensitive value with [REDACTED], return fresh tuples in a fresh list, validate the entire input before output, and never mutate caller data. Add tests and no dependencies.","budgets":{"max_steps":55,"max_seconds":900,"max_input_tokens":100000,"max_output_tokens":20000,"max_cost_usd":3.5},"public_checks":[{"id":"public_tests","type":"command","severity":"diagnostic","argv":["{python}","-m","unittest","discover","-s","tests","-v"],"expected_exit_code":0}],"grader":{"checks":[{"id":"public_tests","type":"command","severity":"required","argv":["{python}","-m","unittest","discover","-s","tests","-v"],"expected_exit_code":0},{"id":"private_contract","type":"command","severity":"required","argv":["{python}","{grader_root}/v2-canonical-header-redactor/test_contract.py"],"expected_exit_code":0},{"id":"protected_dependencies","type":"workspace_policy","severity":"required","protected_paths":["requirements.txt"]}]},"safety":{"network":"disabled","network_allowlist":[],"allowed_write_roots":["."],"forbidden_commands":["sudo","chmod","chown"]},"evidence":{"required_artifacts":["workspace.diff","trace.jsonl","grader-result.json"]},"author_metadata":{"capabilities":["planning","tool_use","verification","safety"],"likely_failure_modes":["planning","verification","safety"],"notes":"Wave-4 serialization/redaction lineage with ordered pairs, canonical aliases, defaults, and injection rejection."}}
