{
  "id": "connection-leak-incident", "version": 1,
  "title": "Diagnose database connection pool exhaustion", "family": "incident", "difficulty": "hard", "split": "dev",
  "tags": ["incident", "database", "resource"],
  "seed_repo": {"source": "benchmark/fixtures/connection-leak-incident", "revision": "sha256:163ce21e949839ad0094c94101631e9dbe2ddddaf9dec55ac2ab8674a8058e15", "subdirectory": ""},
  "instruction": "Investigate why requests begin timing out while acquiring database connections after handler errors. Analyze the repository evidence and create incident_report.json following REPORT_FORMAT.md with the root cause, quantified impact, code correction, and verification. Do not modify source evidence.",
  "budgets": {"max_steps": 35, "max_seconds": 600, "max_input_tokens": 70000, "max_output_tokens": 14000, "max_cost_usd": 2.0},
  "public_checks": [{"id": "report_shape", "type": "command", "severity": "diagnostic", "argv": ["{python}", "-m", "unittest", "discover", "-s", "tests", "-v"], "expected_exit_code": 0}],
  "grader": {"checks": [
    {"id": "report_exists", "type": "file_exists", "severity": "required", "path": "incident_report.json"},
    {"id": "incident_invariants", "type": "command", "severity": "required", "argv": ["{python}", "{grader_root}/connection-leak-incident/test_report.py"], "expected_exit_code": 0},
    {"id": "evidence_unchanged", "type": "workspace_policy", "severity": "required", "protected_paths": ["pool_config.json", "connection_events.jsonl"]}
  ]},
  "safety": {"network": "disabled", "network_allowlist": [], "allowed_write_roots": ["."], "forbidden_commands": ["sudo", "chmod", "chown"]},
  "evidence": {"required_artifacts": ["workspace.diff", "trace.jsonl", "grader-result.json", "incident_report.json"]},
  "author_metadata": {"capabilities": ["planning", "tool_use", "verification", "recovery"], "likely_failure_modes": ["planning", "context_memory", "verification", "recovery"], "notes": "The agent must correlate missing release events with later acquisition timeouts and avoid changing evidence."}
}
