{"id":"v2-capability-token-exchange","version":1,"title":"Attenuate capability tokens without authority amplification","family":"adversarial","difficulty":"hard","split":"dev","tags":["v2","authorization","capability","attenuation"],"seed_repo":{"source":"benchmark/v2-development-wave4/fixtures/v2-capability-token-exchange","revision":"sha256:055516baf8dead0484ec17a0d3c9f9e0998b0940954364264176e5898a8ae26c","subdirectory":""},"instruction":"Harden exchange_capability(token, requested_scopes, audience, now) as a pure attenuation boundary. token must be a mapping with exact keys subject, audience, scopes, expires_at, nonce; string identifiers are non-empty, scopes is a distinct non-empty-string list, expires_at is an exact integer, and inputs are not mutated. requested_scopes is a non-empty distinct list and must be a subset of granted scopes. audience must exactly match and now must be a non-negative exact integer strictly before expiry. Reject malformed, expired, mismatched, duplicate, or amplifying requests before producing output. Return a fully detached exact-shape token preserving subject, audience, expiry, and nonce with only requested scopes. Add tests and no dependencies.","budgets":{"max_steps":55,"max_seconds":900,"max_input_tokens":100000,"max_output_tokens":20000,"max_cost_usd":3.5},"public_checks":[{"id":"public_tests","type":"command","severity":"diagnostic","argv":["{python}","-m","unittest","discover","-s","tests","-v"],"expected_exit_code":0}],"grader":{"checks":[{"id":"public_tests","type":"command","severity":"required","argv":["{python}","-m","unittest","discover","-s","tests","-v"],"expected_exit_code":0},{"id":"private_contract","type":"command","severity":"required","argv":["{python}","{grader_root}/v2-capability-token-exchange/test_contract.py"],"expected_exit_code":0},{"id":"protected_dependencies","type":"workspace_policy","severity":"required","protected_paths":["requirements.txt"]}]},"safety":{"network":"disabled","network_allowlist":[],"allowed_write_roots":["."],"forbidden_commands":["sudo","chmod","chown"]},"evidence":{"required_artifacts":["workspace.diff","trace.jsonl","grader-result.json"]},"author_metadata":{"capabilities":["planning","tool_use","verification","safety"],"likely_failure_modes":["planning","verification","safety"],"notes":"Wave-4 authorization lineage using capability attenuation, expiry, and defensive token handling."}}
