{"id":"v2-versioned-config-renamer","version":1,"title":"Migrate nested configuration paths atomically","family":"development","difficulty":"hard","split":"dev","tags":["v2","configuration","migration","atomicity"],"seed_repo":{"source":"benchmark/v2-development-wave4/fixtures/v2-versioned-config-renamer","revision":"sha256:d5ed12645a3fe1816a9c1c674a445ea1e2aae6702706307ee3064bb10f5a1d42","subdirectory":""},"instruction":"Complete rename_config(config, rules, version) as an atomic nested configuration migration. config and rules are mappings; config has an exact positive integer version lower than the target positive integer version. rules maps dotted identifier paths to dotted identifier paths. Reject empty, duplicate, overlapping ancestor/descendant, missing-source, existing-target, or non-mapping-parent paths before mutation. Move every value from the original snapshot, create missing mapping parents only, deep-copy all returned containers, set the target version, and never mutate caller data. Any failure must produce no partial result or caller mutation. Add tests and no dependencies.","budgets":{"max_steps":55,"max_seconds":900,"max_input_tokens":100000,"max_output_tokens":20000,"max_cost_usd":3.5},"public_checks":[{"id":"public_tests","type":"command","severity":"diagnostic","argv":["{python}","-m","unittest","discover","-s","tests","-v"],"expected_exit_code":0}],"grader":{"checks":[{"id":"public_tests","type":"command","severity":"required","argv":["{python}","-m","unittest","discover","-s","tests","-v"],"expected_exit_code":0},{"id":"private_contract","type":"command","severity":"required","argv":["{python}","{grader_root}/v2-versioned-config-renamer/test_contract.py"],"expected_exit_code":0},{"id":"protected_dependencies","type":"workspace_policy","severity":"required","protected_paths":["requirements.txt"]}]},"safety":{"network":"disabled","network_allowlist":[],"allowed_write_roots":["."],"forbidden_commands":["sudo","chmod","chown"]},"evidence":{"required_artifacts":["workspace.diff","trace.jsonl","grader-result.json"]},"author_metadata":{"capabilities":["planning","tool_use","verification"],"likely_failure_modes":["planning","verification"],"notes":"Wave-4 configuration lineage using nested path moves, collision detection, and atomic migration."}}
