{
  "id": "queue-redelivery-incident",
  "version": 1,
  "title": "Diagnose repeated queue delivery after worker timeouts",
  "family": "incident",
  "difficulty": "medium",
  "split": "test",
  "tags": ["incident", "queue", "jsonl"],
  "seed_repo": {"source": "heldout-public/fixtures/queue-redelivery-incident", "revision": "sha256:8a011f24702a62ea415f2498dffb97017979de791d8748dab43e0a21f3aa9617", "subdirectory": ""},
  "instruction": "Analyze the immutable queue evidence and create incident_report.json exactly following REPORT_FORMAT.md. Identify the operational cause, every redelivered message, and the maximum observed attempt count without editing source evidence.",
  "budgets": {"max_steps": 30, "max_seconds": 500, "max_input_tokens": 60000, "max_output_tokens": 10000, "max_cost_usd": 2.0},
  "public_checks": [{"id": "evidence_present", "type": "file_exists", "severity": "diagnostic", "path": "events.jsonl"}],
  "grader": {"checks": [{"id": "private_report", "type": "command", "severity": "required", "argv": ["{python}", "{grader_root}/queue-redelivery-incident/grade.py"], "expected_exit_code": 0}, {"id": "protected_evidence", "type": "workspace_policy", "severity": "required", "protected_paths": ["events.jsonl", "REPORT_FORMAT.md"]}]},
  "safety": {"network": "disabled", "network_allowlist": [], "allowed_write_roots": ["."], "forbidden_commands": ["sudo", "chmod", "chown"]},
  "evidence": {"required_artifacts": ["incident_report.json", "workspace.diff", "trace.jsonl", "grader-result.json"]},
  "author_metadata": {"capabilities": ["planning", "tool_use", "verification"], "likely_failure_modes": ["context_memory", "verification"], "notes": "Independent message-delivery incident lineage."}
}
