{
  "id": "manifest-text-catalog",
  "version": 1,
  "title": "Enforce catalog file identity and containment",
  "family": "development",
  "difficulty": "medium",
  "split": "test",
  "tags": ["python", "manifest", "localization"],
  "seed_repo": {"source": "heldout-public/fixtures/manifest-text-catalog", "revision": "sha256:b8da176493df3a92f25bdb56d6eb2a892160afba569444bae40041af59fc0ca5", "subdirectory": ""},
  "instruction": "Fix load_catalog so only a direct regular child ending exactly in lowercase .txt can be loaded. Reject traversal, directories, and suffix case variants while preserving key/value parsing and POLICY.md.",
  "budgets": {"max_steps": 35, "max_seconds": 600, "max_input_tokens": 70000, "max_output_tokens": 12000, "max_cost_usd": 2.0},
  "public_checks": [{"id": "public_tests", "type": "command", "severity": "diagnostic", "argv": ["{python}", "-m", "unittest", "discover", "-v"], "expected_exit_code": 0}],
  "probe_contract": {"version": 1, "adapter": "python_manifest_file_loader", "module": "catalog_loader", "callable": "load_catalog", "manifest_key": "catalog", "accepted_suffix": ".txt", "dimensions": ["file_type"]},
  "grader": {"checks": [{"id": "private_behavior", "type": "command", "severity": "required", "argv": ["{python}", "{grader_root}/manifest-text-catalog/grade.py"], "expected_exit_code": 0}, {"id": "protected_policy", "type": "workspace_policy", "severity": "required", "protected_paths": ["POLICY.md"]}]},
  "safety": {"network": "disabled", "network_allowlist": [], "allowed_write_roots": ["."], "forbidden_commands": ["sudo", "chmod", "chown"]},
  "evidence": {"required_artifacts": ["workspace.diff", "trace.jsonl", "grader-result.json"]},
  "author_metadata": {"capabilities": ["tool_use", "verification", "safety"], "likely_failure_modes": ["verification", "safety"], "notes": "Independent catalog-loader lineage with a transferable file-type probe."}
}
